{
  "$schema": "./coverage-matrix.schema.json",
  "$comment": "SPDX-FileCopyrightText: 2026 maninblack; SPDX-License-Identifier: MIT",
  "schemaVersion": 1,
  "matrixVersion": "0.1-review",
  "title": "Automotive Orchestration Coverage Matrix",
  "provenance": {
    "classification": "SANITIZED_DERIVATIVE",
    "confidentialSourceIncluded": false,
    "customerIdentityIncluded": false,
    "directQuotesIncluded": false
  },
  "statusDefinitions": {
    "PARTIAL": "Reusable evidence exists, but the complete proof is not accepted.",
    "PLANNED": "The proof is defined but no accepted evidence exists yet.",
    "DOCUMENTARY_ONLY": "The concern requires policy, compatibility, or support evidence rather than a short live demonstration."
  },
  "items": [
    {
      "id": "AO-01",
      "theme": "lifecycle",
      "concern": "Deterministic software lifecycle with explicit download, install, activation, stop, update, and single-active-instance state.",
      "demoStages": ["G1", "G2", "G3", "G4"],
      "proofModes": ["LIVE_DEMO", "CONTROLLED_QUALIFICATION"],
      "dashboardSection": "release_control",
      "dashboardEvidence": ["artifact_unit_timeline", "active_instance_count", "transition_duration", "failure_reason"],
      "acceptanceCriterion": "Every requested transition reaches one unambiguous state within a recorded bound and never exposes two active instances.",
      "currentStatus": "PARTIAL",
      "claimBoundary": "Existing lifecycle evidence does not yet prove the complete G0-G4 graph or dashboard presentation."
    },
    {
      "id": "AO-02",
      "theme": "service_storage",
      "concern": "Per-service persistent storage with declared ownership, quota, isolation, update survival, and removal policy.",
      "demoStages": ["G2", "G3", "G4"],
      "proofModes": ["CONTROLLED_QUALIFICATION"],
      "dashboardSection": "runtime_assurance",
      "dashboardEvidence": ["storage_owner", "quota", "persistence_result", "cross_service_denial"],
      "acceptanceCriterion": "The service retains only declared state across update and restart, cannot read another service store, and follows the accepted removal policy.",
      "currentStatus": "PLANNED",
      "claimBoundary": "No accepted Brake Health service storage contract exists yet."
    },
    {
      "id": "AO-03",
      "theme": "power_recovery",
      "concern": "Predictable recovery after ignition-like power loss, restart, and interrupted update without identity or accepted state loss.",
      "demoStages": ["G0", "G2", "G3", "G4"],
      "proofModes": ["LIVE_DEMO", "CONTROLLED_QUALIFICATION"],
      "dashboardSection": "runtime_assurance",
      "dashboardEvidence": ["desired_state_before_after", "recovery_result", "state_checksum", "unit_identity_continuity"],
      "acceptanceCriterion": "After every approved interruption point, the Unit returns to the last accepted state with the same identity and an explicit recovery result.",
      "currentStatus": "PARTIAL",
      "claimBoundary": "VM persistence is qualified; application state across all future update phases is not."
    },
    {
      "id": "AO-04",
      "theme": "startup",
      "concern": "Bounded platform and service startup/readiness suitable for an automotive boot sequence.",
      "demoStages": ["G0", "G1", "G2"],
      "proofModes": ["CONTROLLED_QUALIFICATION"],
      "dashboardSection": "runtime_assurance",
      "dashboardEvidence": ["boot_to_platform_ready_ms", "service_ready_ms", "threshold", "sample_count"],
      "acceptanceCriterion": "Measured readiness percentiles satisfy an accepted threshold over a declared sample set.",
      "currentStatus": "PARTIAL",
      "claimBoundary": "Successful boot is known; accepted timing thresholds and repeated measurements are not complete."
    },
    {
      "id": "AO-05",
      "theme": "artifact_integrity",
      "concern": "Artifact authenticity and integrity verification before activation.",
      "demoStages": ["G1", "G2", "G3"],
      "proofModes": ["LIVE_DEMO", "CONTROLLED_QUALIFICATION"],
      "dashboardSection": "supply_chain",
      "dashboardEvidence": ["trust_policy", "immutable_digest", "verification_verdict", "tamper_rejection"],
      "acceptanceCriterion": "Only the reviewed digest signed by an accepted trust anchor activates; a modified artifact is rejected.",
      "currentStatus": "PARTIAL",
      "claimBoundary": "Local provider signing evidence exists; the full staged provider/service Cloud flow is not accepted."
    },
    {
      "id": "AO-06",
      "theme": "resource_governance",
      "concern": "Explicit CPU, memory, storage, and network budgets with observed use against limits.",
      "demoStages": ["G0", "G1", "G2", "G3", "G4"],
      "proofModes": ["LIVE_DEMO", "CONTROLLED_QUALIFICATION"],
      "dashboardSection": "runtime_assurance",
      "dashboardEvidence": ["requested_limits", "steady_state_usage", "peak_usage", "threshold_verdict"],
      "acceptanceCriterion": "Every deployed component declares a resource budget and remains within the accepted steady-state and peak thresholds.",
      "currentStatus": "PARTIAL",
      "claimBoundary": "Some provider resource evidence exists; a complete cross-component budget view does not."
    },
    {
      "id": "AO-07",
      "theme": "transfer_efficiency",
      "concern": "Efficient fleet delivery, including measured payload and transfer savings for an update.",
      "demoStages": ["G1", "G2", "G3"],
      "proofModes": ["CONTROLLED_QUALIFICATION"],
      "dashboardSection": "release_control",
      "dashboardEvidence": ["full_artifact_bytes", "transferred_bytes", "cache_reuse_result", "measured_saving_percent"],
      "acceptanceCriterion": "The dashboard reports measured transferred bytes and savings against the full artifact without assigning an unverified delta-update label.",
      "currentStatus": "PLANNED",
      "claimBoundary": "Differential or chunk-reuse behavior has not been measured in the current environment."
    },
    {
      "id": "AO-08",
      "theme": "dependency_management",
      "concern": "Dependency-aware installation and activation across platform FOTA capabilities and SOTA services.",
      "demoStages": ["G1", "G2", "G3", "G4"],
      "proofModes": ["LIVE_DEMO", "CONTROLLED_QUALIFICATION"],
      "dashboardSection": "release_control",
      "dashboardEvidence": ["desired_state_graph", "dependency_constraint", "required_actual_version", "native_cloud_rejection", "zero_unit_transfer", "activation_order", "readiness_result"],
      "acceptanceCriterion": "After the roadmap capability is released, AosCloud rejects an incompatible service before Subject-service desired-state change or Unit transfer; service readiness remains fail-closed defense in depth.",
      "currentStatus": "PLANNED",
      "claimBoundary": "The current released Cloud/API has no documented Service-to-FOTA-component dependency. Native rejection is deferred to the AosEdge roadmap release; no project-side admission controller is planned."
    },
    {
      "id": "AO-09",
      "theme": "long_term_support",
      "concern": "Defined long-term support, vulnerability response, and maintenance ownership.",
      "demoStages": ["CROSS_STAGE"],
      "proofModes": ["DOCUMENTARY_EVIDENCE"],
      "dashboardSection": "lifecycle_evidence",
      "dashboardEvidence": ["version_support_record", "maintenance_owner", "support_window", "open_policy_gaps"],
      "acceptanceCriterion": "A reviewed support record names maintained versions, ownership, support dates, and vulnerability-response expectations.",
      "currentStatus": "DOCUMENTARY_ONLY",
      "claimBoundary": "A short live demo cannot prove a multi-year support commitment."
    },
    {
      "id": "AO-10",
      "theme": "api_compatibility",
      "concern": "Versioned and backward-compatible APIs between vehicle platform capabilities and post-SOP services.",
      "demoStages": ["G1", "G2", "G3"],
      "proofModes": ["CONTROLLED_QUALIFICATION", "DOCUMENTARY_EVIDENCE"],
      "dashboardSection": "lifecycle_evidence",
      "dashboardEvidence": ["contract_version", "compatibility_range", "consumer_provider_test", "migration_note"],
      "acceptanceCriterion": "The old consumer remains compatible through the declared range and an incompatible combination is rejected before activation.",
      "currentStatus": "PLANNED",
      "claimBoundary": "Versioning intent exists, but the staged compatibility matrix is not yet accepted."
    },
    {
      "id": "AO-11",
      "theme": "artifact_source",
      "concern": "Trusted, immutable artifact sources without reliance on mutable tags or uncontrolled public registries.",
      "demoStages": ["G1", "G2", "G3"],
      "proofModes": ["CONTROLLED_QUALIFICATION"],
      "dashboardSection": "supply_chain",
      "dashboardEvidence": ["artifact_source_policy", "digest_pinned_identity", "provenance_result", "mutable_tag_rejection"],
      "acceptanceCriterion": "Every promoted artifact resolves to an immutable digest from an approved source with retained provenance.",
      "currentStatus": "PLANNED",
      "claimBoundary": "The dashboard and service OCI provenance contract are not implemented."
    },
    {
      "id": "AO-12",
      "theme": "software_composition",
      "concern": "Visibility of transitive dependencies, software bill of materials, and known vulnerability findings.",
      "demoStages": ["G1", "G2", "G3"],
      "proofModes": ["CONTROLLED_QUALIFICATION"],
      "dashboardSection": "supply_chain",
      "dashboardEvidence": ["sbom_identity", "scanner_timestamp", "severity_counts", "policy_verdict", "exception_owner"],
      "acceptanceCriterion": "Each candidate has a digest-bound SBOM and a time-stamped vulnerability-policy verdict before promotion.",
      "currentStatus": "PLANNED",
      "claimBoundary": "No accepted SBOM and vulnerability evidence pipeline exists for the complete demo graph."
    },
    {
      "id": "AO-13",